{
  "contract_version": "1.0",
  "system": "ore-tracking",
  "repos": [
    {
      "id": "ore-api",
      "role": "service",
      "visibility": "public"
    }
  ],
  "components": [
    {
      "id": "api",
      "kind": "api",
      "responsibility": "api responsibility",
      "provides": [
        "tracks-api"
      ],
      "consumes": [
        "tracks-data"
      ],
      "modules": [
        {
          "path": "src/api.py",
          "exposes": [
            "run_api"
          ]
        }
      ],
      "size": {
        "class": "M",
        "functions": 12,
        "tests": 20,
        "basis": "twelve public functions"
      },
      "stack": [
        {
          "tool": "fastapi",
          "version": "0.115.2",
          "ring": "adopt"
        }
      ],
      "unit": "u-api",
      "gates": [
        "P3-red",
        "P4-green"
      ],
      "repo": "ore-api"
    },
    {
      "id": "tracks-pipeline",
      "kind": "pipeline-stage",
      "responsibility": "tracks-pipeline responsibility",
      "provides": [
        "tracks-data"
      ],
      "consumes": [],
      "modules": [
        {
          "path": "src/tracks-pipeline.py",
          "exposes": [
            "run_tracks_pipeline"
          ]
        }
      ],
      "size": {
        "class": "M",
        "functions": 12,
        "tests": 20,
        "basis": "twelve public functions"
      },
      "stack": [
        {
          "tool": "fastapi",
          "version": "0.115.2",
          "ring": "adopt"
        }
      ],
      "unit": "u-pipe",
      "gates": [
        "P3-red",
        "P4-green"
      ],
      "can_be_absent": true,
      "availability": [
        {
          "state": "available",
          "adapter_returns": "what the adapter returns when available",
          "response_block": "block with state available",
          "ui_shows": "what the page shows when available",
          "test": "test_availability_available"
        },
        {
          "state": "missing",
          "adapter_returns": "what the adapter returns when missing",
          "response_block": "block with state missing",
          "ui_shows": "what the page shows when missing",
          "test": "test_availability_missing"
        }
      ]
    }
  ],
  "evaluations": [
    {
      "id": "api-framework",
      "concern": "HTTP API framework",
      "decision": "fastapi",
      "ring": "adopt",
      "adr": "ADR-0003"
    }
  ],
  "contracts": [
    {
      "id": "tracks-api",
      "kind": "openapi",
      "path": "docs/contracts/api.openapi.json",
      "version": "1.0.0",
      "frozen": true
    },
    {
      "id": "tracks-data",
      "kind": "json-schema",
      "path": "docs/contracts/tracks.schema.json",
      "version": "1.0.0",
      "frozen": true
    }
  ],
  "units": [
    {
      "id": "u-pipe",
      "components": [
        "tracks-pipeline"
      ],
      "consumes": [],
      "provides": [
        "tracks-data"
      ],
      "wave": null,
      "agent_role": "implementer"
    },
    {
      "id": "u-api",
      "components": [
        "api"
      ],
      "consumes": [
        "tracks-data"
      ],
      "provides": [
        "tracks-api"
      ],
      "wave": 2,
      "agent_role": "implementer"
    }
  ]
}
