{
  "contract_version": "1.0",
  "system": "graph-fixture",
  "repos": [],
  "components": [
    {
      "id": "pipe",
      "kind": "engine",
      "responsibility": "pipe work",
      "provides": [
        "tracks-data"
      ],
      "consumes": [],
      "modules": [
        {
          "path": "src/pipe.py",
          "exposes": [
            "run"
          ]
        }
      ],
      "size": {
        "class": "S",
        "functions": 3,
        "tests": 5,
        "basis": "three functions"
      },
      "stack": [
        {
          "tool": "python",
          "version": "3.13.0",
          "ring": "adopt"
        }
      ],
      "unit": "u-pipe",
      "gates": [
        "P3-red"
      ]
    },
    {
      "id": "api",
      "kind": "engine",
      "responsibility": "api work",
      "provides": [
        "tracks-api"
      ],
      "consumes": [
        "tracks-data"
      ],
      "modules": [
        {
          "path": "src/api.py",
          "exposes": [
            "run"
          ]
        }
      ],
      "size": {
        "class": "S",
        "functions": 3,
        "tests": 5,
        "basis": "three functions"
      },
      "stack": [
        {
          "tool": "python",
          "version": "3.13.0",
          "ring": "adopt"
        }
      ],
      "unit": "u-api",
      "gates": [
        "P3-red"
      ]
    }
  ],
  "evaluations": [],
  "contracts": [
    {
      "id": "tracks-api",
      "kind": "json-schema",
      "path": "docs/contracts/tracks-api.schema.json",
      "version": "1.0",
      "frozen": true
    },
    {
      "id": "tracks-data",
      "kind": "json-schema",
      "path": "docs/contracts/tracks-data.schema.json",
      "version": "1.0",
      "frozen": true
    }
  ],
  "units": [
    {
      "id": "u-pipe",
      "components": [
        "pipe"
      ],
      "consumes": [],
      "provides": [
        "tracks-data"
      ],
      "wave": null,
      "agent_role": "implementer"
    },
    {
      "id": "u-api",
      "components": [
        "api"
      ],
      "consumes": [
        "tracks-data"
      ],
      "provides": [
        "tracks-api"
      ],
      "wave": null,
      "agent_role": "implementer"
    }
  ]
}
